{"base":{"commit":"6429d55789885e7d144f3c663223384821814149","source_record_sha256":"e3965fbc252a518ee06af91d2797fdcfb241e7b1a3eb8dd81088240cbc2560c4","tree":"4273ecf8d52735b1ccac74c3e2ddd4ee73e3fa2a"},"build":{"cmake_arguments":["-DCMAKE_BUILD_TYPE=RelWithDebInfo","-DOPTION_RL_ENVIRONMENT=ON","-DOPTION_RL_NEURAL_AGENT=OFF","-DOPTION_USE_ASSERTS=ON"],"generator":"Ninja","jobs":8,"logs":{"build":{"bytes":65289,"path":"/home/thecl/.codex/artifacts/openttd-rl/v2-m22-final-runtime-c/build.log","sha256":"d51b14e2a946f7c4f0c2083809fef13c015f51af48ac1e778ce55d30078187b7"},"configure":{"bytes":4569,"path":"/home/thecl/.codex/artifacts/openttd-rl/v2-m22-final-runtime-c/configure.log","sha256":"6cd5e51f79de029ad851960d26d281b982e2dc3307b13b525506f6af1311cc30"},"ctest":{"bytes":22149,"path":"/home/thecl/.codex/artifacts/openttd-rl/v2-m22-final-runtime-c/ctest.log","sha256":"ce5e82ddc44e4c698ec2f9fa6408387d738ba625731712ac09c8969b3f6958cb"},"junit":{"bytes":38813,"path":"/home/thecl/.codex/artifacts/openttd-rl/v2-m22-final-runtime-c/ctest.xml","sha256":"88964480d37c2aa4b2ad5c6670987568f4593aa661db825fd0cb83e16f825f01"}},"test_inventory":{"bytes":4138,"path":"/home/thecl/.codex/artifacts/openttd-rl/v2-m22-final-runtime-c/ctest-inventory.json","sha256":"286cf50046876ea0c29bb3b8ec269f60bf5a55faf203c76a93f614ef11ade3ca"},"upstream_ctest":{"passed":98,"total":98}},"executable":{"bytes":424742304,"path":"/home/thecl/.codex/artifacts/openttd-rl/v2-m22-final-runtime-c/build-final/openttd","sha256":"f38b63a2d431411d30e44e7d3c43e46268cf2556c3bde1b74bc3291af52b0577"},"final_boundary":{"expected_manifest_sha256":"e35383d49ff72e36249a1cce4750153c41a39526b2f769f029a8f4619a203697","manifest_executions":0,"manifest_opened":false},"patch":{"path":"integration/openttd/patches/15.3/m22/final/0001-Add-M22-final-world-overrides.patch","sha256":"de3bc6c33fed0dbf619c927060a0960fe4006c37010a6346b8c4661989a93f32","touched_files":["src/rl_v2_action.cpp","src/rl_v2_air.cpp","src/rl_v2_broad.cpp","src/rl_v2_cargo.cpp","src/rl_v2_competition.cpp","src/rl_v2_environment.cpp","src/rl_v2_final_world.h","src/rl_v2_rail.cpp","src/rl_v2_ship.cpp"]},"prerequisites":{"m20_source_record_sha256":"45d54206d9e7dc92fe6b5188c063bbbfd95218f369d351c94709917ff23feb20","m21_source_record_sha256":"e3965fbc252a518ee06af91d2797fdcfb241e7b1a3eb8dd81088240cbc2560c4"},"repository":{"commit":"c0c3ac70436dcea467f26db11e5bf3ab2e7a2f1d","tree":"a4fa90a7fe600f28f5f5cce12dff61f3ad1905e3"},"retained_artifact":"/home/thecl/.codex/artifacts/openttd-rl/v2-m22-final-runtime-c","runtime":{"ai_archives":[{"bytes":1239040,"name":"AAAHogEx","path":"/home/thecl/.codex/artifacts/openttd-rl/v2-m22-final-runtime-c/content_download/ai/484f4745-AAAHogEx-115.tar","sha256":"40796e8beb127965e3aa9cd1a9683ca689adaefe9c131d849b69def65bba9cb4"},{"bytes":174080,"name":"KrakenAI2","path":"/home/thecl/.codex/artifacts/openttd-rl/v2-m22-final-runtime-c/content_download/ai/4b524132-KrakenAI2-3.tar","sha256":"3f7812ea51d0ae6f8109e65639e7062c7fe5bd236d4a328f9f0baab0c2958fdb"},{"bytes":20480,"name":"NoOpAI","path":"/home/thecl/.codex/artifacts/openttd-rl/v2-m22-final-runtime-c/content_download/ai/4e6f7041-NoOpAI-4.tar","sha256":"44fdaeac656c53f787d95af5b8eb1bd18585ed7f09fc21056ff44f4550167b57"}],"ai_libraries":[{"bytes":30720,"path":"/home/thecl/.codex/artifacts/openttd-rl/v2-m22-final-runtime-c/content_download/ai/library/4752412a-Graph.AyStar-6.tar","sha256":"4e76533f1f38240bf8bb5abfca0b6cc2ea182a1c6ccf7f5f3980e5ae8d219e27"},{"bytes":40960,"path":"/home/thecl/.codex/artifacts/openttd-rl/v2-m22-final-runtime-c/content_download/ai/library/5046524f-Pathfinder.Road-4.tar","sha256":"64b178e3d9c28a0d41e9bdace02ee119ae2e7c986de560c40eed51fa684e31ae"},{"bytes":30720,"path":"/home/thecl/.codex/artifacts/openttd-rl/v2-m22-final-runtime-c/content_download/ai/library/51554248-Queue.BinaryHeap-1.tar","sha256":"a83eb5002b1246330dfc467dbd1076687d227156a697cc140f6d04515cf3bb67"},{"bytes":368640,"path":"/home/thecl/.codex/artifacts/openttd-rl/v2-m22-final-runtime-c/content_download/ai/library/5350524c-SuperLib-40.tar","sha256":"19dd0c6416872ec90fe92fced9d1cfc0e239a500a1017838840c554f4e014c70"}],"configs":{"base":{"bytes":10143,"path":"/home/thecl/.codex/artifacts/openttd-rl/v2-m22-final-runtime-c/base.cfg","sha256":"b23c83b3fd8ad48796ff86f26311670bbddb417a16884e4aea3e3e43587bc69d"},"content":{"bytes":10336,"path":"/home/thecl/.codex/artifacts/openttd-rl/v2-m22-final-runtime-c/content.cfg","sha256":"f9b7c931d9bad6715cfeea6ae3a90365fc04ab763fa74f8556f7c46cfd092874"},"gamescript":{"bytes":10157,"path":"/home/thecl/.codex/artifacts/openttd-rl/v2-m22-final-runtime-c/gamescript.cfg","sha256":"564fccd2144859cb8b36bbfd3c4a1a57b2f428fb10429c2407befadc9a2c51ac"}},"gamescript_files":[{"bytes":542,"path":"/home/thecl/.codex/artifacts/openttd-rl/v2-m22-final-runtime-c/build-final/game/m21coverage/info.nut","sha256":"389551c12b89da966a3c7ce72a13e9371c096f5b634b40f2b463aceb93ee1989"},{"bytes":142,"path":"/home/thecl/.codex/artifacts/openttd-rl/v2-m22-final-runtime-c/build-final/game/m21coverage/main.nut","sha256":"fbf4b436b584ae88c7eaf8ddb5e4bb3862cc821726f7fb6b64c1aab34d1c7a56"}],"network_calls_during_preparation":"none","newgrf_archives":[{"bytes":1290240,"path":"/home/thecl/.codex/artifacts/openttd-rl/v2-m22-final-runtime-c/build-final/content_download/newgrf/414e0201-Squid_Ate_FISH_FISH_2_Ships-2.0.3.tar","sha256":"bbca24a526c87cb0364eb139144377c21869fc37491f586ce082c0fcef0754cd"},{"bytes":768000,"path":"/home/thecl/.codex/artifacts/openttd-rl/v2-m22-final-runtime-c/build-final/content_download/newgrf/415a1001-RattRoads-1.2.1.tar","sha256":"d2f9780002f774b6403fa9a49aebb9749b220e8769f87b47a765cfa9f30980ce"},{"bytes":1454080,"path":"/home/thecl/.codex/artifacts/openttd-rl/v2-m22-final-runtime-c/build-final/content_download/newgrf/43415000-OpenGFX_Airports-0.5.0.tar","sha256":"d1844d4cff339de864b490aa7fae58660673219f18b48719bcdb8fb71f47379c"},{"bytes":133120,"path":"/home/thecl/.codex/artifacts/openttd-rl/v2-m22-final-runtime-c/build-final/content_download/newgrf/454e1401-OpenGFX_Stations-1.0.tar","sha256":"c2171c54c2149948e22503647b09bb35c77ea3f859ae1419c287d7e9bf86e415"},{"bytes":4065280,"path":"/home/thecl/.codex/artifacts/openttd-rl/v2-m22-final-runtime-c/build-final/content_download/newgrf/4e445903-Age_of_Industry_Replacement_Set-1.3.2.tar","sha256":"2eada82f0d99505e76d4aefb523e49c076f29b0938508080fb28a6a6a52c689d"},{"bytes":327680,"path":"/home/thecl/.codex/artifacts/openttd-rl/v2-m22-final-runtime-c/build-final/content_download/newgrf/4f472b31-OpenGFX_Trains-0.3.0.tar","sha256":"7ca9a4743d87c3470a201a001aa3ede2129b637d54393ae9cb3dd7bc28245f49"},{"bytes":2519040,"path":"/home/thecl/.codex/artifacts/openttd-rl/v2-m22-final-runtime-c/build-final/content_download/newgrf/52415608-RAV8_Rangless_Av8-1.00.tar","sha256":"9168b7a6be81c8c610d5b0fadb7dcc0768c8d68d960a847eb0f20965456bee30"},{"bytes":4659200,"path":"/home/thecl/.codex/artifacts/openttd-rl/v2-m22-final-runtime-c/build-final/content_download/newgrf/52580101-FIRS_and_CHIPS_style_objects-0.1.10.tar","sha256":"7f1c85ea07f9792364a246b745cea28dd972440bd83f9701329e3eabd9083543"},{"bytes":3768320,"path":"/home/thecl/.codex/artifacts/openttd-rl/v2-m22-final-runtime-c/build-final/content_download/newgrf/54574606-Timberwolf_s_Tracks-1.3.0.tar","sha256":"28c4a8edd9c4c789e63f96e8c846b8ec4cae79d9c31575ae98c713b870952d4b"},{"bytes":2416640,"path":"/home/thecl/.codex/artifacts/openttd-rl/v2-m22-final-runtime-c/build-final/content_download/newgrf/9787eafe-Road_Hog_Buses_Trucks_Trams-1.4.1.tar","sha256":"b83b0fb43815e2eec5722ddbbe80a4f01ea0c9c95f7d6965198138e49a4d4663"}],"newgrf_files":[{"bytes":1247782,"path":"/home/thecl/.codex/artifacts/openttd-rl/v2-m22-final-runtime-c/build-final/newgrf/m21/fish.grf","sha256":"3a7d7578ba477b2ebb3a57d52548b9bb0b0cc931a6c5c19a620a41a37f78536d"},{"bytes":727614,"path":"/home/thecl/.codex/artifacts/openttd-rl/v2-m22-final-runtime-c/build-final/newgrf/m21/rattroads.grf","sha256":"0d3969b56859988dc4a12f5538dd4dab3e1f3e6df655ca92d3544f6bf9963892"},{"bytes":1418267,"path":"/home/thecl/.codex/artifacts/openttd-rl/v2-m22-final-runtime-c/build-final/newgrf/m21/airports.grf","sha256":"eee51e40b08bb4a91f44b53650fd9375e7b653d61428d4d64bb4bf4865453902"},{"bytes":111163,"path":"/home/thecl/.codex/artifacts/openttd-rl/v2-m22-final-runtime-c/build-final/newgrf/m21/stations.grf","sha256":"dbc9501ba0146aa7329a168d8933eb799979c7dd7ac197150d2adacfaaee4baf"},{"bytes":4042547,"path":"/home/thecl/.codex/artifacts/openttd-rl/v2-m22-final-runtime-c/build-final/newgrf/m21/industries.grf","sha256":"e96988a20a623e089dc17d3e6c98b9f3c80405e9a548565febb4d8d11d1533db"},{"bytes":280435,"path":"/home/thecl/.codex/artifacts/openttd-rl/v2-m22-final-runtime-c/build-final/newgrf/m21/trains.grf","sha256":"70c8096a8b0aac6ea59fa0a3d78330fe6e67b86db5a7983de161ccf7c23e95c1"},{"bytes":2490213,"path":"/home/thecl/.codex/artifacts/openttd-rl/v2-m22-final-runtime-c/build-final/newgrf/m21/aircraft.grf","sha256":"397ea103164fe2ed14431bcc80e13e9d78c42a7a894201fb02dcf254f418a941"},{"bytes":4624843,"path":"/home/thecl/.codex/artifacts/openttd-rl/v2-m22-final-runtime-c/build-final/newgrf/m21/objects.grf","sha256":"3025a9dde5b24057dc9c64f48cb8ef2f3bb355565d692cc47fd95720e0c39484"},{"bytes":3736577,"path":"/home/thecl/.codex/artifacts/openttd-rl/v2-m22-final-runtime-c/build-final/newgrf/m21/tracks.grf","sha256":"3a9fcc4200cb2d2e4face94981142fcccb1cf01267a08db652db65d069d662dc"},{"bytes":2380212,"path":"/home/thecl/.codex/artifacts/openttd-rl/v2-m22-final-runtime-c/build-final/newgrf/m21/roadhog.grf","sha256":"aa9d9d99a99ece9810e4232161de9641d5444158d889237cadf2b7e68936b572"}],"open_gfx":{"bytes":5396480,"path":"/home/thecl/.codex/artifacts/openttd-rl/v2-m22-final-runtime-c/build-final/baseset/opengfx-8.0.tar","sha256":"9389bcb0807058c80bd95121e978f05d9ef86b4b1bc3ac2da8da8bb02456043c"}},"schema_version":"openttd-rl-v2-m22-final-runtime-source-1","smokes":[{"artifact_root":"/home/thecl/.codex/artifacts/openttd-rl/v